place_id,name,avg_rating,lat,lng,user_ratings_total,reviews
ChIJZyHLap1zj1QRsXed9OifaS0,Banana Republic,3.6,48.4468504,-123.3705564,56,"Great place to shop.

Diana is fabulous very knowledgeable and helpful. So is Sebastian. Truly most of staff is nice there. Probably because Kim, the manager trains them well.

Love the quality of their clothes.Jeans smell of mothballs after a first rinse in water. Multiple washings have not removed the stench. The manager had not heard of that before and only offered an exchange instead of a refund, so BR does not accept responsibility for defective products. A brief internet search reveals this mothball issue is a real thing. Will not buy there again, and I feel sorry for others who end up with the same problem. In the store there is no hint of mothball smell, it manifests only after you get homeTerrible service...
I ordered a couple things online under final sale.. loved them but that sizes were wrong and either the local store or online were willing to help. Refused to change the sizes for me and / or do a store credit.... no matter if it was ""final sale"", online ordering should always be subject to either option as the sizes specially at Banana Republic are not consistent.

I guess lesson learned... I was a regular shopper and this situation will for sure affect my shopping with Banana Republic.My experience at Banana Republic in the Mayfair Mall in Victoria today was less than pleasant. I was not properly greeted, no eye contact was made, and I felt shoved out of the way by staff and customers when i was trying to look at the merchandise. I won’t darken their doors again.Staff were great, I wish the sizing wasn’t so short though, mens fit used to be much better. I’d guess the people writing negative comments about customer service are probably clueless that Covid has affected service staff levels… I’m sure it was traumatic not getting greeted, must be tough spending daddy’s dirty money all day, everyday. Sigh."
ChIJ98JVdIxzj1QR5ruLmavidzk,Just For You Fashions Ltd,4.9,48.4480909,-123.3444088,16,"I cannot recommend this store enough. The employees are helpful and kind and you can tell they love where they work! They always have great stock for a wide range of styles! Definitely my go-to place for fun and stylish work clothes heading back into the office :)The staff are amazing!  This is my ""go to"" place to buy clothes.  They are honest about how items looks and have great suggestions.  I have my favourite labels and recently ordered 5 tops over the phone.  Jackie had my order ready for me to pick up at the door.  Wish I could give 6 stars!Great boutique. I was looking for French dressing jeans and they had them in stock.  The sales lady was lovely and  super helpful. Sure beats the box stores. Love local shops like this!Hi Jackie;
Thanks for the fast great service from you.
Just wanted you to know that I picked up my new sweater & jeans today & they both fit - & look perfect together! I wasn't worried about the sweater but I thought maybe the jeans wouldn't be right (maybe I'd changed & my old jeans were no longer the correct 4P?) But no, I slipped into these new jeans like butter & now, I just have to wash them to be 100% sure. They seem exactly right.What a great shop!  My daughter and I broke out after 2 months of Isolation to visit our favourite clothing store.  We felt so comfortable with the precautions in place and the staff were just wonderful.  They even had their signature gumdrops individually packaged for customer treats."
ChIJDej0PaJzj1QRd_EDMgYjz40,Plenty,3.9,48.4548138,-123.3754615,69,"Customer service is non existent, not even a basic greeting was given. I went in wanting some help finding an outfit for an event but left because not one person greeted me or asked me if I needed anything, I walked around browsing for quite awhile too. Lost a sale because you ignored me.I've been to this location several times and always have a great experience! I've bought items from here a couple times and the staff have always been really helpful and friendly. The times I was just browsing the store the staff were great too. I knew they were there to help but not hovering, which is perfect. The store is always clean and they have great selection...such cute clothes! Wish I could buy everything in the store!!Hit and miss with the Staff. I am a fairly regular customer and tonights service was below average. I had some of my items brought to the front desk while I continued to shop and when I went to pay for everything  she forgot to add them, I kindly reminded her that she forgot those items. I thought she ran all the items through, as there were only two items, a dress and a belt to match the dress. She didn't put the belt with the rest of the order, although it was clearly indicated both items were to be added to the order. Cashier: Sofi and/or Associate: Taylor M, not sure which one but I have seen her there a few times while I shop and who ever it was had a horribly snobby attitude while she was ringing everything through. There is no reason for the horrible service I received from that one employee. As a store that sells fairly nice and pricey clothing the attitude of your employees should match exactly that! Thanks, I will make an extra trip to get the belt and it should not have been missed in the order the first or second time, seems like intentionally rude behavior. I hope the owner of the store takes better care of their employees so this doesn't have to happen to any customer, especially a regular....shameful!  At least the new girl was amazingly nice and helpful, along with the other lady helping me with dress sizes. Sometimes it's really great service, but the end of that shopping experience left a bad impression on customer service and satisfaction.Their selection has improved dramatically (for the better) over the last few years. It's an odd mix of brands carried rhough, you have $300+ quality denim brands and then poorly made $50+ sweaters that the store has carried forever for reasons I don't understand. The staff at this location make sure your never standing around with items your going to be trying on, if you have any questions they will most likely make it to you and ask if you need anything before you even realize you do.. that being said, (and not all of them) but quite a few of the girls are not exactly very polite, in fact some of them can be quite bluntly judgemental and give off a very unwelcoming and entitled (not sure to what) aura. It resulted in me associating the whole store with these negative interactions I experienced and have witnessed others experience as well,  It would be a much more satisfying experience if the employees who give off this impression be reminded that as employees they are meant to represent the company  and the brand's it carries, be that negative or positive it does reflect back onto the store.The customer service is questionable at the uptown location. The staff wasn't helpful and when I asked about professional wear. She pointed to a region and said you can find them in that region but all I saw were jeans and casual clothing. I guess maybe it's not the place for professional wear. But the staff, she could have told me sorry, we don't sell anything like that. Her attitude was surprisingly ignorant. I will never go in there again and I definitely prefer Zara more."
ChIJFa0A1hZ0j1QRMUHr2xhuf1M,Citizen Clothing,4.8,48.4275542,-123.3688248,36,"It was as if this place was made for me. I probably liked 85% of the items I tried on. Staff are awesome. Above and beyond just being helpful and friendly. I picked up a lot of good pieces. My only regret was I didn’t visit this place at the start of the day. I’ll definitely be coming back next time I’m in townBoutique menswear store - independently owned and operated.  Great assortment of stylish men’s casual shirts and pants/shorts.  If you are in Victoria go here first.My favourite clothing store in Victoria! The staff are friendly and helpful, and the owner has very good taste in the items he stocks. Most of my favourite Fall and Winter jackets were purchased at Citizen.My husband & I have been shopping at Citizen for several years now. We love the high quality of the clothing and the personable, thoughtful service that Patrick provides. It's one of our favourite stores in Victoria.I had a fabulous experience shopping at Citizen today! The owner took care of me, offered personalized help and expert advice. He totally got my boyfriend's style and helped me pick out the perfect new wardrobe. I highly recommend this store for visitors wanting some new duds and locals who need a go-to place to shop for every season. Love it!"
ChIJ7SEkRJ1zj1QRfA7UAWnO4ZU,RW&CO.,4.5,48.446624,-123.3696118,74,"My shopping processes was smooth as it could be, I made an appointment the week before, and showed up the day of and was greeted with a smile and they where ready for us right away, Manual assisted us (party of 6)  with our fittings and he was beyond fantastic, he listened, and made everyone feel involved. I left with everything we needed. Wedding planning has been beyond stressful and this was made so stress-free I cant thank Manual enough. I spent a total $1,598.76 Worth every penny!Great clothes, awesome staff, and phenomenal return/exchange/price guarantee policies. Quality of clothing is high and reliable from this brand. No loose threads or poor stitches or fabrics. Price is appropriate if not even a bit low for what you get. Great value for money. Lots of available styles to suit one's needs and desires. Sales are abundant and further the value. Thanks RW&CO.Excellent selection and pricing. Always up to date on the fashion trends. The staff and manager are very friendly and provide professional customer service. Thank you!Really Wonderful staff. Very helpful. And, add to that impressive collection. If you are looking for classic fashion, this is the place to be.Big shout out to Steve for helping me find a wedding officiant outfit a few days ago. She was so helpful and kind. I only wish larger sizes were better stocked - the company itself doesn't seem very size inclusive, though perhaps it's a supply chain issue. But the staff here are great and I've had a good experience every time I shop here. :)"
ChIJ5znK6Zp0j1QRlYpVcWtxk50,Bodacious Lifestyles Boutique,4.3,48.42633130000001,-123.3231422,17,"Bodacious is always my first choice for quality clothing. Lorna is an absolute joy and her staff are both knowledgeable & willing to offer assistance, if required.  The Oak Bay store is bright & spacious & above all, most welcoming. Customer service is obviously a priority, which is a unique & rare occurrence in retail today.  Well done Bodacious. You are exceptional.It hasn't been easy during Covid, but Lorna has managed to maintain a lovely, safe and friendly environment to enjoy browsing for beautiful plus-size clothing and accessories. Lorna sources amazing lines and even helps to design pieces specifically to her client's tastes. Thanks for continuing to give us fabulous fashion right here in Victoria!I shopped on a Saturday night from the comfort of my own home. The website images inspired me cuz the owner is the real deal of a woman. She models her own clothes! I was looking for two summer tunics and found what I was looking for along with what I hoped would be perfect leggings. I sensed I could trust the sizing and images presented. So I placed my order. Then a box with a hand-written label addressed to me arrived on Wednesday the following week. When I opened the box, I was delighted to see that my expectations were met. Beautiful garments! And wrapped with care and attention to detail. Thank you Bodacious for being who you present yourself to be -- a celebration of the feminine in all her wisdom, elegance & beauty! Excellent & efficient service. Supremely gorgeous clothing. Loving detail. I will shop again soon!Great clothing and accessories…….fun…comfortable….good quality……..A little pricey but beautiful clothing and accessories, including plus size. You won't see these things at a department store."
ChIJ7zF86Y90j1QR8gOKxX6XO0Q,FOLK,3.9,48.4284043,-123.3688079,45,"Walked in here thinking I wouldn’t find anything as I wear plus size. The woman working, who I’m assuming isthe owner, was immediately so warm, friendly, and personable. I pulled a pair of gorgeous linen pants on to try and she had me give her a little fashion show, it made me feel so special. She brought me so many other cute vintage and non vintage plus size pieces to try and was SO attentive. I felt like I was shopping with a friend. The other staff members were just as kind and sweet!

This shop is amazing and also so well curated and gorgeous. I highly recommend checking it out, even if it’s just so the very nice pretty ladies working there can share their positive energy with you. It really made my day and now I have a well made pair of pants I’ll probably have for the rest of my life.

Thank you guys for making my day!!Folk is the best clothing store in Victoria -- hands down. The quality is excellent and the items are carefully selected for their aesthetic and clean silhouettes. As a busy, small-business owner, I don't have a lot of time to get dressed in the morning so I appreciate that anything I get at Folk I can throw on in the morning and instantly look professional, stylish and put together. I'm surprised to see people complain about prices -- as an adult, you look at a price tag and willingly walk to the cashier to buy something. If items are available in other places, i.e. online, posted prices often do not reflect shipping and customs, which can quickly jack up the price. (This recently happened to me with a jacket I bought online, and it increased the price of the jacket by 35%. In hindsight, I wished I had given that money to a local business instead of Canada Customs.) Additionally, the prices at other places do not reflect their culture. Buying something online to cut costs can mean that employees on that end are paid minimum wages, whereas at Folk the employees are local people with good jobs and happy smiling faces. If I want a $6 t-shirt, I'll go to H&M where my stepson shops. In the meantime, I'm a business professional and plan to continue giving to local businesses and looking fly while I do it. A pic of my favourite tunic is attached, which I got at Folk and for which people stop me on the street to ask where I got it every. single. time.Recently checked out this store for the first time while visiting Victoria with a friend. Lots of very cute minimalist pieces and a very pretty store overall. The main reason for my review is that the woman helping me was so fun and outgoing. I didn’t catch her name but she made my experience so amazing; I’ve never felt so good going clothing shopping before! This woman is definitely an asset to the business and a natural salesperson.Bought an amazing vintage Escada dress here and I must say I
loved the vibe of the new location. Felt very warm and inviting. The owner Willow was super fun and very helpful and I felt very looked after as a client. It’s hard to find exceptional customer service these days and I felt the owner was beyond exceptional and that a lot of private stores in Victoria could learn from her example. Thank you again for an awesome shopping experience and a fabulous dress!LOVE the vibe of this beautiful shop. The owner and all her staff are pure magic. Its incredible to walk into such an amazing space, and get this? THEY ACTUALLY SAY HI TO YOU WHEN YOU ENTER!! So important in my opinion. I love the mixture of vintage clothes, what a smart idea. The owner is always a dream to speak too, and AWAKE non the less. Which in these ""fake woke"" days is VERY HARD to come by. I will absolutely be back and so looking forward to the next time....ALSO, what is with people complaining about no refunds? lol what planet do you live on that you think refunds are just given to you by a small business, IT'S ALWAYS IN STORE CREDIT. So stop your btchin' trolls, these woman are incredible. If you don't dig where the clothes are made, stop trolling and kindly shop elsewhere. Needed to get that off my chest as BULLY'S and me DO. NOT. VIBE. I will absolutely be back"
ChIJC2XDKpt0j1QRvGGWeYAOxZY,Street,3.7,48.4264635,-123.3672939,27,"Staff was attentive and I got this cute little Rhythm(one of my favourite brands) crop top on sale! I wish had some low rise denim shorts but if I’m being honest, that’s hard to find these days.Spend over 400$in this store today but the staff was brutal . Cute clothes .Both staff member on their phones and no regard to help at all .. worst customer service around . Highly recommend evaluating your staff some major coaching opportunities. Do better  .I don’t usually take the time to write reviews but I stopped in here quickly yesterday to buy my daughter some jeans. I didn’t have a lot of time to search so I asked the little reddish brown haired sales associate to help me. I admit I was a little pushy but I was in a rush. The associate was balancing phone calls and other customers but never once did I feel I was an inconvenience. Not only was I assisted in getting the perfect pair of jeans but the one on one service I received was great. I will definitely stop in with my family next time we are on Vancouver island.Would put 0 stars if I was able too, worse customer service ever ! 2 of them just sat around till. Didn’t bother to greet or ask if we needed help.  One girl was just eating a donut on the floor with other customers in store.This place is wicked! No grief and the service was on key! Will I continue shopping there....well yes obviously and so should you (if it's anyone reading this that doesn't work there...well unless you shopping there then keep doing it :p )"
ChIJM2sayYR0j1QRt16ssbT2kIg,Flavour,4.3,48.4274552,-123.3679051,94,"Their clothes are super cute and I love the style, but unfortunately I have to give a bad review. Every time I’ve been here the customer service is lacking. No one ever greets you, asks if you need a room or are friendly at all. My sister bought a dress here and wore it for a few hours and then the next morning wanted to wear it again, and there was already a hole in it. Cheap quality and bad service, will be skipping it from now on.I discovered this store today and I absolutely fell in love!  They have great selection and very welcoming, energetic staff ! I’ll be back!Flavour downstairs has some good selection and reasonable prices. Flavour upstairs (vintage) is an absolute miss. It seems as though their entire collection is based on an 80 year old lady named Geraldine. A lot of the staff seem to embody that, with a general vibe of 'get off my lawn' instead of welcoming customers in. Many items are priced more expensive than their retail price... I'd say stick to downstairs storefront or avoid altogether.They've done a great job of curating their clothing and the prices are all fair. Really funky clothing and great customer service. I had a really good experience with a girl named Lily who made our day! She was very kind and went out of her way to help us out.I used to avoid this store because they carry a variety of brands and the sizing can be a bit of a nightmare if you're a curvier person like me.

The staff that are at this location now are very laid-back and approachable people. I really enjoyed my last visit and bought a gift for a friends birthday, and was pleasantly surprised when the sales associate helped me wrap the earrings and ensure it was ""gift ready"".

If you like cute clothes in various styles, definitely check this place out!"
ChIJQ3I_XnV0j1QRBnAfSSa_evM,Suzanne's,2.9,48.446453,-123.3349914,14,"Went in there to find something for my wife on Sunday. The woman working was so rude and unhelpful. I told her the description of the top I was looking for and she didn’t even bother to help me, she just went back to being on her phone. I eventually had to ask another woman, a customer mind you, to help me find it. I ended up leaving with nothing. I hope no one else has had this issue. Unacceptable!Nice selection of clothing. Very helpful lady. A but pricey.I went into the Hillside Suzanna’s this evening. The assistant asked me if I needed help to which I replied that I was just browsing. The assistant then responded in a disgruntled tone that she should charge everyone that comes into browse. So I turned around and walked back out again. No wonder the shop was empty. They need to work on customer service.I have worked in this store as a sales associate and the managers were racist and impolite to me and other previous sales associate. Also, the whole store is  TRASH!
Do not waste your money.I have been here a couple of times now and I always seem to find something. Could have had one more sales person so while one was helping the other could have watched the cash register. It seems a sale was missed and it upset the ONLY sales person. I felt quite sorry for the sales person."
ChIJQ3I_XnV0j1QRjUCa5WmJfJ4,Ricki's - Hillside Centre,4.8,48.44601,-123.33633,82,"I wanted to thank the sales associate for going above and beyond this evening. A top in the window caught my eye for my daughter, about 15 minutes before closing. The sales associate was so helpful, even taking the top off the mannequin to get the size I needed. She inquired about my daughter’s age and made sure to give me a PST exemption because she’s a minor. She was so helpful and professional throughout the entire interaction. Plus, when I got home, my daughter adored the top like I knew she would! Great store, great service.Everyone at Ricki's Hillside is so upbeat, helpful, and friendly. I always love going in there. And mostly I find some great new item at a decent price. The pants especially fit me well. I think by now 90% of the pants I own come from Ricki's. Thanks, team!One Saturday afternoon, I popped in to Ricki's to return an online purchase.  I usually don't love going to stores these days finding it difficult to get help...often finding unengaged staff. This was not the case at Hillside.  Browsing, I was asked by two different employees if they could assist or start a change room for me.  Once I did try something on, the staff was super helpful and cheerful!  Regan at check out was great and completed my experience on a high note.  You have the most amazing team in this store and I will be sure to return -- thank you!As always I find something I am looking for when I go to Ricki's Staff were so helpful and made sure it was the correct size and look and for me. Visit them you will be enjoy the experience whether it is a date night outfit, something for work or just something casual there is always something for you.The sales staff were very friendly , helpful and full of cheer.  They made sure I understand the current sales.   Thoroughly enjoyed my shopping experience there."
ChIJ3ZOvnpp0j1QRaEIiTSxmXyU,Bagheera Boutique,5.0,48.4242155,-123.3670363,9,"Fantastic service and fabulous clothes!  Thank you for providing my mom, sister and I with a very pleasant shopping experience.  You helped me find both pants and tops that suited my personality and body type.  I was very pleased. This is what shopping should always be like.  Friendly, stress free and fun.  It was extra fun that you had your 50% sale on when we were in your lovely store, now almost two weeks ago. Again, thank you!I've heard a lot about this new store from my friends and decided to give it a try. I have been to other mid to high-end boutiques in Europe and, to be honest, I didn't expect to see anything even close to those European stores that I visited. To my huge surprise, this store impressed as soon as I stepped in. Very bright and stylish and at the same time inviting and comfy. You can see the store owners put a lot of work and love in this place.

In addition to the store design, I was taken back with the clothes selection and how it's tastefully organized on the rack and the shelves. Kudos to Natalie and Maria!

And what a service! These girls treated me as VIP and for this short period of time I was given some beautiful choices for outfits and also the style that would suite me the best.
It's definitely not your ordinary store. I'll be back for more shopping!I had a fantastic experience here. The lady at the shop was so warm and helpful; she picked out some great options that I wouldn’t have picked myself. Vast selection of very high quality clothing from Europe.Outstanding women's fashion shop. Great selection, excellent quality and terrific service. Not the cheapest stuff, but worth the cost. Shame the Langley store has closed. :(Love the quality of the clothes and also the warmest services and great advices from the kind lady who works there. I go there all the time now."
