place_id,name,avg_rating,lat,lng,user_ratings_total,reviews
ChIJLc-B1y51j1QRybLlo8AtbH8,The Breakwater,5.0,48.4148436,-123.3850737,8,"An excellent vantage point to feel the ocean. Take a walk and explore wild life along the way. Killer whales, seals, sea lions, and so much more. A great place to chat and catch up with friends or showcase out of town guest the beauty of Victoria's shoreline. A jewel of Victoria not to miss.The breakwater has long been a favorite place of mine. An easy walk of about 5-10 minutes will take you to the light beacon and end of the breakwater. Has great views of the harbour and the ocean front. Sometimes when cruise ships are in port it can be very busy. On windy days you are quite exposed to the wind and possibly ocean spray.  Historically there were no fencing on the breakwater but now they have railings along the top on both sides. At a few points, you can go down stairs to access the lower breakwater. The lower break water can be difficult to walk on as it is just large rectangular stones that can be uneven. The lower breakwater is often where divers scuba dive and people fish.Located on the waterfront with ocean and mountain views. Cycling and pedestrian trails follow the shoreline overlooking the Juan de Fuca Straight.Holland Point to Ogden breakwater light ↩️ walk evening is a favorite with magnificent ever-changing sky, light, and season. We are blessed.Most go while in  Victoria! Super fun and chill walk. Kids friendly. Not to crowed and people respect each other pace. Perfect sunset spot"
ChIJb1X0SJdzj1QRcy5rVRRiutM,Glasgow Park,4.3,48.4540636,-123.3620932,30,"Tiny park with a path between busy streets. Great short cut to take. Nice pocket if trees and nature in the middle of a very urban areaReally pretty little park with lots of trees and a community library.Small park but very clean and quietThere's a Pokemon gym here that I took over on my way home. Go Team Winstinct!Lots of fun to be had here, lots of events in the summer"
ChIJVQL1CJx0j1QRfOEOxkOKsAU,Songhees Point (p’álәc’әs),4.7,48.4257651,-123.3758275,369,"a nice place to see what is happening in the inner harbor as well as getting a close up view of seaplanes landing and taking off.Beautiful place for a nice walk.It’s a small, but great little spot. I expected it to be a bit larger, but our main goal was to see some of the totem poles British Columbia has to offer. These are absolutely gorgeous and huge. There are some large rocks you can climb up to get a beautiful view of Victoria and the ocean at the same time. Take 20 minutes out of your day and enjoy it.Just a great place to spend time watching the water craft and waterfowl. Although the walkway could use a good cleaning of the goose droppings (at least once a week). Even in a minefield you have a chance of not stepping on a mine. nasty.A shore hugging park along the waterfront of Victoria’s Inner Harbour, Songhees Point Park is a great place to watch the navigation of seaplanes, Coho Ferry, private yachts, sailing boats and Victoria Harbour Ferry boats.

The one and half hectare park encompasses the start of the Westsong Walkway, a three kilometer pathway to Esquimalt, at the Johnson Street Bridge. Trees and shrubs shade wonderful places to stop for breaks and to take a photo.

At low tides Discovery Rock might be accessible over the rock and mud seafloor. The Delta Victoria Ocean Point Hotel borders the parkland and has many beautiful flower displays. Tuzo Rock is just off shore. And a lovely small sandy beach can be found on the east side of Songhees Point at low tides. Include a stroll up the rocks that form Songhees Point, there is evidences of glacial activity on these granite rocks as well as an unique outdoor art.  There are several benches and grassy points along the four hundred meters of paved and concrete footpaths. This is a wonderful park to explore in your neighborhood."
ChIJ-37xUw5zj1QRekLSdj7Tvt8,Tillicum Park,4.1,48.4552397,-123.4000895,25,"It's another dying mall.I love this place, I go here 5 times a week :)Nice trail that allows dogs, however, there's no garbage cans!!Not so great. Does the job for a short dog walk. Hobos nearby.Great park for the family!"
ChIJE0J8iuB1j1QRFNGIQW3RrSI,view of Victoria Harbour,5.0,48.4227006,-123.3685232,6,"Beautiful night views of the habor and lighted buildings.the most beautiful place to take pictures in VictoriaBeautiful place!The beautiful harbor where all kinds of yachts are moored, the nearby BC Provincial Parliament and the characteristic buildings of the Empress Hotel are even more admirable."
ChIJ2_vuNsJ0j1QRUMw8yx0nX5w,Finlayson Point,4.8,48.4065827,-123.3646443,268,"It's a great spot to spend time with family or friends, also it's a pic of the scenery. The environment is so refreshing, along with the coastline.A beautiful place to see the ocean view. Lots of benches here. Love the tranquility here so much!Had a great time here, got a fair bit of exercise jumping from viewpoint to viewpoint. The is also a designated area to fly drones which was new for me but happy it is visibly posted. Such an amazing skyline and plenty of animal life in and above the waters. Plenty of walking along the shoreline, which I will definitely be back to explore more. Great for biking, jogging walking and most importantly our furry family members, there are off leash areas as well. Summer time hot spot for tourists and there are plenty reasons why they flock here, honestly this park is great any time of year, so please come and see for yourself and you will be back too. Highly recommended 👌Great spot to stop on the coastline for some beautiful and relaxing views. We came while cycling along the water and it was lovely even with lots of clouds in the sky. There weren’t really any access point here to get to the beach, but those were far off along the coast.

Our next visit was sunny and even more lovely. Great views in Victoria!Lookout point to the south of Beacon Hill. Has benches and great panoramic views, but isn't anything out of the ordinary based on most of the viewpoints and beaches here!"
ChIJM7l59IVzj1QRwxu-HTiSfJE,Summit Park,4.6,48.4455795,-123.3545887,333,"A nice place for a (relatively) easy walk to the top of the hill for good views of the cityscape and surrounding areas.

The landscape in the park is a typical uniquely Victoria one. There’s a play area for children and a reservoir area that people run around for exercise after running up the hill.

A nice alternative for views to Mount Douglas park.My favourite neighbourhood park! Gary oaks that look spooky in autumn, berries along the reservoir all summer, and birds year-round. Beautiful mural on the tower and incredible sunset views.This park changes with the seasons and offers both grand vistas and an opportunity to see beautiful wild flora. Easy walking paths wander through glades of Garry Oak and rock out-cropping. A small play ground, makes this a perfect park to take the family out to experience some Victorian nature and to gain some perspective. There is something magical about the place.Beautiful place to walk. Especially in spring when it's full of wild flowers. Nice little park for the kids and the reservoir is cool too check out.I absolutely love this part but the only reason it doesn't get 5 stars because sometimes the animal control patrol officers hang out there accosting people and putting everyone on edge."
ChIJ0cy3pU10j1QRHFGvj-kREoo,Anderson Hill Park,4.7,48.4131456,-123.3065653,219,"Beautiful area with views of Olympic park and the waterway. Fairly accessible, can view from the sidewalk or walk down on the rocks. Parking lots is small, about 5 cars. The chairs on the rocks were nice to sit and enjoy the view and sounds.A blustery day to explore Anderson Hill!
Fantastic view of The Olympic Mountains ⛰️ one way, then a glimpse of Mt Baker.
A few benches, a few small trails, limited parking.Well worth a goat like scramble up, dogs to be kept on a leash, not overly busy beautiful place for city dwellersThis is a local dog running park with a beautiful view. Be aware that there is no access to the beach despite that some of the posted pictures suggest it. The park is mostly surrounded by private properties and accessible from a trail. There are a few benches to sit and enjoy the view and the sunshine.Nice little green space tucked away in Oak Bay! Beautiful views of the Olympic Mountains ⛰️ and Mt Baker."
ChIJ7YymxUtzj1QRS1tgqbOU5M4,223 Robert Street National Historic Site,0.0,48.4288848,-123.3884531,0,
ChIJI2A8s4R0j1QRtxKdWrtz-LE,Milne Block,0.0,48.4278668,-123.3688875,0,
ChIJG7dhXpp0j1QRy4207Qatxfw,Old Victoria Customs House,5.0,48.4244364,-123.3698408,6,"It's a gorgeous building, but I'm reviewing it so Google will stop asking me to review it. This thing really needs an obvious ""don't ask me to review this, people I know work here"" button.Oldest house in town, landmark. Worth visiting!"
ChIJMWJI5fB0j1QRTeZqQZv7k5U,Ross Bay Villa,4.9,48.4119083,-123.341825,10,"We went to the Ross Bay Villa for the Grand BC Confederation Day Garden Party to celebrate the 147th anniversary of BC entering the Canadian Confederation.

It's a small historic home lovingly restored with thousands of hours of volunteer's efforts.

Don't miss this place if you're interested in local, BC, or national history!Educational and interesting tour of a lovely historic home. Definitely worth one or more visits!!What an amazing restoration by a group of volunteers!  Well worth the visit to see what they did and hear stories about those that used to live there.We had a tour from Nik today. He was such an excellent tour guide. Very knowledgeable surrounding Victoria history in general, and especially concerning the Ross Bay Villa. There has been so much period-accurate work done.  It is all volunteer run and you can tell how passionate everyone is in the incredible details they have put in. Go check this place out!!Well done! A meticulously restored 1860's heritage home by a talented and ambitious group of volunteers and professionals alike. Every Victorian should visit and appreciate this treasure. Keep up the good work."
ChIJx5Ggp4R0j1QRY_kdCFH3VwA,Finlayson Building,5.0,48.4286158,-123.3686652,1,"Everything in Victoria BC CANADA is fabulous, each building tells its story, and completes the beauty of this Victorian style city.
Victoria is considered small, but it's not, there's a lot to discover in this charming city.
It's the best of all public transport, even going to other cities, you don't even need to rent a car, in winter maybe. Always have your cell phone charging, to photograph the beauties you will find on the way."
ChIJ_9rCKG90j1QRm_ppv_2tvCY,Begbie Hall,3.7,48.4310734,-123.3290923,18,"We had a few meetings at Begbie Hall - presumably named after a Vancouver Island judge from the 1800's. He was known as 'the hanging judge' - and I don't think the reference is about hanging wallpaper. Anyway, Begbie Hall has been upgraded but it still retains that musty old building smell. We learned the hard way that the door to Begbie Hall is locked promptly at five o'clock pm. I'm sure the judge would approve. What I like best about Begbie is that there is a washroom directly inside the front door.This is the home of the Heart to Heart Alumni meetings. This was my second guest appearance as a speaker. I was able to educate folks on medical travel insurance for hard to insure cases.I work here this part of the hospital is offices this use to be where nurses in training would live while going to schoolIt is The royal jubilee meeting room  in the original  RJH  could seat 1p0 with probably placed chairs for a meetingBeautiful old building with architectural wonder."
ChIJabIakW50j1QR8dSwI503a3I,Pemberton Memorial Operating Room,0.0,48.4327774,-123.3278824,0,
ChIJGw0s_J10j1QRv27dcJ0U904,E&N Roundhouse,4.4,48.4301786,-123.3813651,57,"Victoria Beer Week held the Fresh to Death beer event here. Very cool venue!Very cool to explore the ""abandoned"" trainyard roundhouse and the see the turntable and few train cars still there yet also still feeling sad it'll be converted to condos. Would recommend checking out before that happensThe facility is unique, interesting and fun. The only disappointment was the misleading advertising regarding the Jersey Boys performance. Yes,  some of the cast made an appearance,  but this was a Time Benders performance from start to finish. A fun evening,  but certainly not promoted accurately.Great spot for a gathering, lots of atmosphere, spacious, near the water if you wanted to stroll away for a walk, lots of parking. Would be awesome if a band can play for an event there.Cool building, lots of charm, good big size, ideal for the Christmas craft fair that I went to. Good to hear it will be developed and used for local business."
ChIJAQDUBI50j1QRy4G5j5lloTg,Cecil Roberts House,0.0,48.4213968,-123.3594546,0,
ChIJBYkqDnx1j1QR_kUOOH6kbkA,Queen Victoria Statue,4.2,48.4205189,-123.3699425,26,"Historic statue if Queen Victoria.Beautiful amazing historic statue !!! Love it 🇬🇧🇨🇦🤝🤝Beautiful statue of queen Victoria and a great front view of the legislature and if you look behind you there is the Salish sea which is one of kind and very beautiful alsoBeautiful statue at the heart of the beauty of Victoria! This area is the area to check out for sure. With the Legislative Buildings on one side, the beautiful fountain on the lawn, and the harbour and many other amazing buildings in the distance (like the Empress), it is no wonder why Victoria is one of the most spectacular cities in the world.Historic statue 🗽 overlying Victoria inner harbor"
ChIJhZZuWIl0j1QR0LSxuZ8kcMI,Wentworth Villa - Architectural Heritage Museum,4.2,48.4233491,-123.3516013,13,"Cool place to learn about the history of Vancouver. The self guided tour is not that long, so it is easy to do with the other attractions in the area.The passion shown by staff is worth 5 stars. Still progressing in some exhibits but staff are knowledgeable,  enthusiastic,  and inspiring.  Definitely a must see.See examples of 19th century domestic architecture. The museum offers an insight to the lovely historical homes around Victoria. Its not just another house museum.Exploring the history of all cultures is always of interest and this place is rich with the history and knowledge of Victoria's early colonial beginnings.Great little museum with interesting local history."
ChIJdwcdJ4p1j1QRfolY490ZgIU,Pioneer Square,4.3,48.422911,-123.359335,40,"Nice park just outside of the main city centre areas. Lots of space to sit out on the grass in the sun or under a tree, as well as on one of the many benches.
This park is a mix of grassy areas, flower beds, tombstones/graves and pathways. Great spot to stop for lunch.I love this small park that is extremely accessable. My favorite break spot to have lunch. It also has a lot of fascinating history. Right next to the cathedral church and apparently it's an old graveyard. Very peacefulPioneer square is our go to park for quiet time.  This park has an interesting past you can read about from the Victoria historical society.  In the summer it provides great shade and never truly gets too busy.  A perfect spot to sit back and enjoy your personal music.  Located next to Christ church cathedral on Quadra, the park is easily accessible and only a few blocks from downtown.It is downtown green space provided by the Anglican Christ Church Cathedral.  It is a pioneer graveyard leftover from the days when death was grandiose.  Many headstones.  There are many benches and places to sit.  In the summer it is an oasis of cool shade provided by the canopy of abundant old growth deciduous trees.Just a nice quiet place to sit on a bench and have lunch among green grass and large old trees."
ChIJlY3z7fJ1j1QRT-R6v9unuTg,Shoal Point,0.0,48.4233172,-123.3878724,0,
ChIJsUgw84R0j1QR5brpbMRTWKQ,Ker Block,5.0,48.4281136,-123.3658882,1,
ChIJRYc73Nh1j1QRM7p1iyKs4Z8,Beacon Hill Park Historical Bandstand,5.0,48.4148469,-123.3647903,4,"It’s a nice place for a walk and to see some natural beauty. Park has lot of beautiful ducks all over the pond. It’s quite nice to sit there for a while and watch themGreat spot for a picnic and to listen to some music.beautifulNice place to go with the family, the animals that are in the place have an impact"
ChIJ5dvsgwJ1j1QRwClpkc5eh9c,BC Legislature Garden of Honour,0.0,48.4180661,-123.3722363,0,
ChIJ6bS89A5zj1QRVTUdEuQ0teA,Chapman Point Victoria Heritage Foundation,5.0,48.4422423,-123.3850322,1,"Chapman Point
Victoria Heritage Foundation
137 Gorge Rd E

Built: 1885
To: Charles & Matilda Thomson

ARCHITECTURE:
2 storey Italian
Known for many years as the Dingle House Restaurant, it was attributed to John Teague, although there is no evidence that he was the architect. It was built for Charles William and Matilda Ringler Thomson, who lived in it until their death in 1916. Charles, or “Gasworks Thomson” as he was affectionately called, was born in London, England, in 1827. He left in 1859 for the Gold Rush in California, ended up on Vancouver Island and became a mule trader, supplying pack animals in the Cariboo. In 1860, Charles married Matilda Midwinter in San Francisco. Matilda was born in Kent, England, in 1823. The couple came to Victoria and Charles became secretary and eventually manager of the newly formed Victoria Gas Co (502 Pembroke St., Burnside). He also had other interests, including real estate and finance, becoming a partner in BC Loan Co. Charles and Matilda succumbed to bronchitis during the bitterly cold winter of 1916. The $1 million estate went to Charles' sister, Janet Ringler Thomson, who left the house empty for nearly two years."
ChIJM0kIJH5zj1QRMZsXefWRFpU,Bay Street Substation,5.0,48.4356419,-123.3663468,1,"Everything in Victoria BC CANADA is fabulous, each building tells its story, and completes the beauty of this Victorian style city.
Victoria is considered small, but it's not, there's a lot to discover in this charming city.
It's the best of all public transport, even going to other cities, you don't even need to rent a car, in winter maybe. Always have your cell phone charging, to photograph the beauties you will find on the way."
ChIJ_4Idp_V0j1QRCmNVU93QGWA,The Cary Castle Mews,4.4,48.4184065,-123.3400337,23,"When visiting the Government House gardens you can usually find ample parking in the large lot behind the main residence.  Nearby is the tea room that is run by the volunteers, and it’s a good place to buy a light lunch at a reasonable price.  There is two museum rooms that feature costumes and formal clothes that were worn by the Lt. Governor and his or her spouse.  The museums are free to visit.Pretty cool. Behing government building.A visit to Government House in Victoria should always include time to see the Costume Museum.  Lovely display of mostly women's fashions through the years, many belonging to previous Lieutenant Governors or Chatelaines.  Also displays of military uniforms and other historical artifacts.  Then stop for lunch or tea at the Tea House.  Open during the summer, Tuesday through Saturday, 10:00 - 4:30.Tea room is a good spot for lunch or tea  no specialty coffee   costume museum is worth a visit featuring gowns of Govt house Chatelaines and uniforms  gardens are livelyIt's so beautiful,  quiet and charming. Good for walk, have a coffee or just seat and watch the birds"
ChIJL_SaUJF0j1QRBpArvk9xVxg,Helmcken House Pioneer Doctor's Residence,3.8,48.4196432,-123.3670943,13,Very interesting & instructive.Very interesting and educative.House museum which was not open when I was there and no posting of hours. It was interesting to read the description of his life and it gave a good idea of what life was like when Vancouver started.This place is a very interesting piece of Canadian history. Worth the time to visit.Very informative guide who gave us a good understanding of the Helmcken family and the era.
ChIJn_edsOl0j1QRuwcxbTGKBDk,Spiral Beach,4.7,48.4072976,-123.3570624,171,"This is a nice spot to access the beach or for some stunning views of the water and surrounding beaches. Last time we came, it was a cloudy day, but it’s a beautiful view on any day! Access to the rocky beach area is along a wooded path and down a spiral set of castle-like stairs, which is very unique!This is a stretch between Beacon Park and Clover Point park. There is a walking path between Dallas Rd and the beach, as well as off-leash dog area, which is unfenced between Dallas Rd and the walk path. You can see the beach and watch the birds in the flowering bushes along the path.Gorgeous mountain view on this trail. The trail is nice too, located close to Beacon Hill, there is also some parking. You can walk down about 80 stairs to the water. Relaxing spot. A little windy.Amazing view of the mountains, and you can still see the city off to the side. Great place to take the dogs off leash. No sand to get everywhere, just little pebbles that are nice to walk on.A must! If rocky beaches with perfectly smoothed rocks are your thing, then this is the right place for you! You can see Washington state across the water on clear days. BUT be mindful that sometimes your cellphone signal can wander over to the US side. Have had roaming charges so now I turn it onto airplane mode."
ChIJXWa5LhZ0j1QRECvc48lFjVA,Willows Beach,4.6,48.4330412,-123.3038901,1932,"Victoria's most popular swimming and paddle boarding beaches. Its shallow and protected waters are suitable for young children, while views of Discovery Island and Mount Baker make basking, swimming or paddling there just that much more beautiful.

Willows Beach is ideal for enjoying summer activities such as beach volleyball and skimboarding, due to its sand beaches and shallow waters great spot for family gatherings and outdoor barbecues.Victoria's most popular and favorite beach. The wide lawn and beach are family-friendly. There is parking nearby, but it is very difficult to get a spot on weekends.Great beach with small food restaurant in the middle.Popular staple beach in the neighbourhood.  Parking lot by the park on Beach or along esplanade.  Long beach with logs for sitting and playing.  Surprisingly the water has lots of nice sand if you walk out a bit in some areas.  Playground and grassy area for picnics with the rotary tea house in summer time.  Oak Bay Tea party is held here in June which is good for a visit.  When looking at the water on the far left is Cattle point so good walk up there.  Uplands park is nearby to walk around in and easy to get lost in as well:-}  Popular beach but never seems too busy as it is very long.  Great place to enjoy the day.  Fish & Chips shop 4 blocks up Estevan so not far away.It has a great view, and the park in front of it is a boost for those who don’t like only sand. It could use more eateries, although the only one there is good. Also, washrooms should be cleaned more constantly. The smell is unpleasant."
ChIJfQ9FePB0j1QRZ8oWXT9SG-A,Ross Bay Public Pebbles Beach,4.8,48.4099053,-123.3412776,76,"Beautiful beach, be careful where you park your car. I had my driver's door smashed in. The person hit my car backing up quickly because the traffic was non-stop and moving fast.
Might be a good place for a couple speed bumps so people have time to back their cars out slowly and safely.This is a great place to stop for a rest if you’re strolling along Dallas Road, going for a cycle along the Victoria coastline, or just while driving through.

This is a typical BC beach, with rocky sand and driftwood, as well as beautiful views and a relaxing atmosphere.Nice walk along the ocean. Lots of places to seat and rest if needed. Has parking and Shaw open.Great spot for the kids to explore. Lots of pebbles. Nice water front walkway. I will visit again for sure!This beach is more stones than pebbles and is near road level for easier access. Limited parking at either end."
ChIJV4LpZPh0j1QRKUE1VB_Flrs,Gonzales Bay,4.6,48.4122214,-123.3270376,533,"Often busy and not a beach to visit unless you can handle the god awful smell. Ocean side beaches don't often have the most pleasant aromas, but this may be one of the worst I have ever experienced in that regard.Nice chill beach, protected waters for SUP boarding. Seems like you might have a chance to see an elephant seal. Only thing no dogs June-August plus the standard no booze or fire.Very nice & quiet neighborhood beach.  Several picnic tables and someone has added a tree swing near the picnic tables.  Restrooms are clean & well maintained.Looks like a great beach, didn't have time to swim. Parking is a bit tricky but well worth the stop. Public washroom and changing room.Very nice beach but not very wheelchair friendly."
ChIJl4Owh7h2j1QRmcC4PGU_0uE,Baynes Beach,4.4,48.4536994,-123.2660226,41,"Nice place to rest and stay for couple hours. And beautiful views as well. Hope everyone could see this wonderful place on a wonderful day!It's a small beach with tricky, rocky access. However...it is a beautiful area. There is limited parking, so be mindful of the neighbours.A nice place to sit relax and if your really lucky you'll see some orcas swim by.Beautiful scenery. Parking is the problem as in residential area. Not really a beach, no sand, just rocks and dead wood and very small.Great spot to sit at all hours of the day and just enjoy the water from a relatively secluded area"
