place_id,name,avg_rating,lat,lng,user_ratings_total,reviews
ChIJEYdD9YBzj1QRq4NdHek3fUM,Part and Parcel,4.8,48.4390833,-123.3592693,621,"Following the high rating on Google I made my way to this inconspicuous little gem in the Quadra Village of Victoria. It’s easy to pass it on the street so keep looking if you miss it first time. The food is some of the best I’ve ever tasted. I got there in time for happy hour and tasted two amazing appetizers for $8 total. One was made from only chickpea flour and deep fried to perfection served with a delicious spicy sauce. The second delicious piece was grilled pork belly. The flavour was fabulous. I ordered the Kalettes veggie main course and again the flavours didn’t disappoint. Rich and unusual while being amazing. My server strongly recommended the chocolate dessert which I cannot say enough about. It was sweet, salty, creamy and decadent without being overpowering. Overall the meal was 5 star. The vibe of the place is calm and smooth while being friendly and relaxed. I will definitely be back.Overall great experience! Started with a condensed milk shaft that I absolutely loved and every dish that followed was great. I ordered the pork and the texture was perfect, very soft and dissolved in your mouth. The broccoli and the cheesecake were also super tasty. I ordered three dishes to share, one cheesecake, and one cookie and it was more than enough for two people so I recommend sharing. Service was great, we sat at the bar and they were very attentive and helpful when explaining portion size etc. I would definitely recommend this place!Good food, nice staff, and cute atmosphere!

Probably more ideal for groups between 2-5, though I'm sure larger groups can be accommodated for if you come early enough.

No on site parking, but it was easy to find a spot around the block.

However, I do agree with another reviewer about prices. I didn't mind it because I enjoyed the food in the end, but, for what you get, the price does catch you a little off guard. Would still recommend going here at least once, though!Rice and Pickles bowl, with fried chicken.

Peanuts did not smell like they were freshly toasted, but instead had a musty aroma. Rice was clumpy and not well washed/cooked/fluffed. Pickles were okay, chicken had great texture in the batter but seemed pinkish and the seasoning had not penetrated throughout the meat. Food was served warm but not hot. Mediocre at best.

Service was good, atmosphere close to perfect.
Overall a disappointing experience due to the food.This has got to be the best fried chicken sandwich I’ve ever had! It was juicy and crispy and the sauces were all finger licking good! The menu changes often too so I can’t wait to come back when it does!"
ChIJtzM29Jxzj1QR73BMdD7MOmw,Red Robin Gourmet Burgers and Brews,4.0,48.4483218,-123.3687696,2979,"A delightful lunch enjoyed at a slightly lower price with a birthday coupon.  The Whiskey River BBQ, Red Robin Gourmet Cheeseburger and Onion Rings were all perfect.  Coke refills are more pleasing.  The friendly and attentive server made the meal time enjoyable.  I went right at opening time, but soon a lot of people came.  There is a large parking lot in the back, so don't worry about parking.Great burger! I have a dairy allergy and our server Renee helped us navigate the menu with ease. She was friendly and really fast with our order. The BBQ whisky river burger was stellar 🙂 will be back againHighly recommend!   This was our first visit to this restaurant, and we were not disappointed.  Generous portions.  Clean, comfortable atmosphere.  Convenient location.  Excellent service (Grayson was our server today).  Love the idea of unlimited refills on sides and bottomless beverages (which even included ice cream floats!).  Huge variety on the menu.

Shown here is the Madlove Burger and steak fries. Delicious.  One of the best burgers I've eaten!A fave weekend spot for burgers and fries.(for the kids) After a play date @Beckwith Park, and before a bouncing bunch over @The Flying Gerble!! On some super full stomachs 🥰 Tbh I just show up for the bottomless fries.. even tho, they usually cut me off at seven or eight baskets.. 😇😎☠️❤💯Ordered through Uber eats. Did not receive cheese dip. Subbed fries but received a side salad? I even ordered gravy but that didn’t clue them into providing me with the fries I ordered. Also ordered side bbq  but they added that to my cheeseburger instead making it gross and soggy. Did not receive dip for Yukon chips. It was such lays wavy chips? Lots went wrong here. Wish I got fries to make me feel better. I can maybe drink the gravy to relieve my pain?"
ChIJNao82Jl0j1QR8Ht3R0E6e_E,Victoria Harbour House Restaurant,4.2,48.4211323,-123.3744302,443,"Exploring Victoria, taken aback by the rich diversity in culture and history we were lucky to stumble across this hidden gem. Located only steps away from the Best Western Plus Inner Harbour hotel, the Victoria Harbour House Restaurant boasts a well rounded menu for varying palates.

The staff were friendly and helpful and the service was one of a kind... the personal touch and humor provided a welcoming atmosphere...Bob was fantastic!

The food was well prepared and the presentation was simple but perfect for this particular place.

We had the Escargot Bourguignon and French Onion soup to start... both very delicious !

We enjoyed the 6oz New York Steak with Lobster... the steak was seasoned and cooked to perfection!

We also had the Shrimp scampi which was served with a very delicate but flavorful white wine sauce... yummy!

Can't forget to mention the fantastic wine and dessert selection! The Crème Brulée was one of the best I've had, the Lemon Cheesecake with blueberry sauce was light and flavorful, and the Chocolate Mousse was dreamy!

Overall 4.5 🌟 for quality, taste, service, location, experience, and atmosphere!

The hours are 4pm to 8pm... we went as a walk in and were lucky to get a seat; I would recommend a reservation.Good friendly service and attentive. They had a special for steak and lobster with a salad. The lobster was good but the steak was lower quality for sure. The bread was good though. You will need a vaccine card to dine in. They are only opened during dinner hours.Celebrated my husband's birthday in this quaint and home style atmosphere. Waitress was attentive. Food was very good. Been in business for 40+ years. Would eat here againService was good. But non-alcoholic cocktails contain alcohol. 5 months ago, I had gastric cancer surgery. so absolutely alcohol is dangerous to me. also, my friend's food has a kitchen iron brush. My birthday dinner has become a risky meal.4/5 and 4/6/23:  It’s not often good cuisine meets stellar service and wonderful atmosphere!  As a solo diner, I didn’t feel slighted and was seated at a window table.  I had the spaghetti bolognese on day 1 and returned to have steak & prawns with the house salad on day 2.  I was a happy grandma.  Thanks, Julie!"
ChIJeVwsJYB0j1QRn7FdyRpPUp8,Wendy's,3.3,48.4358351,-123.3631557,1240,"Edit: The service here is ABYSMAL. Dude only filled my chili cup half way, after I had to remind them about it because they didn't put it in my bag. Had to ask for hot sauce and crackers too. I understand that fast food is the bottom of the barrel for jobs, but it's incredible how incompetent some people can be.

If there is more than one person in line, don't expect to get your food for at least 10-15 minutes. Almost as slow as the Pandora Mcdons, which is saying something. Food is good, but holy smokes the staff are slllllllloooooooooooooooooow.We came in just after 10am today to try their breakfast croissant after receiving coupons in the mail. I had the silly idea yo give the place yet another chance after multiple disappointing experiences.

A number of other reviewers have commented on dirty/sticky tables. I can verify that this should be expected - seeing dirty tables at opening.

I wasn't acknowledged by the person behind the counter, even after saying hello...  Eventually, a manager and a counter staff came to the till and logged in (no greeting or explanation of what was happening).

The customer experience was disappointing I felt like my morning visit was an inconvenience. Unimpressed with the quality and tasty of the food.

It's nice to see rapport between staff but it's important to be mindful that it's a job and not a social space.

There was a training session in progress near my table and good information was being provided to incoming staff.. hence the 2 stars instead of 1.

The quality of coffee cups was the impressive aspect of my visit. I wish these guys the best... Wendy's is my fast food outlet of choice but I do not recommend visiting this location.The staff is so friendly and awesome! Every time I go, I see them working so hard behind the counter and they give me very delicious lunches. My only issue is some days (two Fridays I've tried so far) the dining room is closed due to lack of staff and since I don't drive a car here, I can't order, but that's no fault of the employees. Keep up the good work Wendy's!I was crew on opening day for this location back in 2002. (I think that was the year) anyway.. the process has changed so much that the food prep is not the same. The quality coming from this location has been consistently poor. When I asked for a fresh crispy chicken, you know.. the nice crispy ones? Yeah, I got the chicken that expired in the draw of shame. It was nasty.

The meat used to be hand laid and pressed (4 corner press) and now they use the clamp method of cooking in masses and it doesn't have the same level of care. Nor did it speed up the process.

I used to love Wendy's when quality was actually their recipe....The food quality is a bit better at Wendy's compared to other fast food offerings, and it is nice they have more healthy options on the menu - baked potatoes, salads and chili. The most frustrating thing about this location is the order completeness when going through the drive through. Regularly items are missing or incomplete. This gets worse if you have any modifications to items but also regularly will miss dressing for salad, utensils, etc."
ChIJ12sgE5B0j1QRZkOrokQGuN0,The Sticky Wicket Bar & Restaurant,4.1,48.4230776,-123.3654012,2429,"Steak was well cooked with delicious herb butter on top. Brussel sprouts were way undercooked, mashed potatoes were really salty. Mac and cheese is incredible, though - you can add chicken, broccoli, etc for an extra charge. Our server was nice, but only visited the tables on each side of us (not ours) in the last 20 minutes, so it took a long time to get our check. We never got a refill on water either, but maybe they figured the bottle of wine was adequate for us 😉 Be aware that there's a game room with pool etc, sports games on TV, so it can get a little loud if you're seated near it. Main dining room is relatively quiet otherwise, or it was when we went. Basically the food is good, service is alright, and they have a rooftop patio that looks great. The food was good enough that I'd give it another chance when I'm in town. It wasn't particularly busy, but maybe our server had more tables in another room that kept her busier than we were aware of?Old world charm meats big screen TV's.
Nice selection of both import and local brewery beer. I went with the wicket lager, it's brewed by Vancouver island brewery.
Menu is not overwhelming and it's easy to find something you want to try. Whether it be bangers and Mash, a burger or even mac and cheese.
The food is seasoned well and decent portions.
Staff were all welcoming and friendly.  We did find that one gentleman who brought the food to the table wore entirely too much cologne. It was to the point I would sneeze every time he walked past us.
Perhaps businesses need to bring back the no scent atmosphere for their customers convenience.
We will return.
Import beer is priceyCool atmosphere. We were visiting Victoria and stopped in for some drinks and food. First place that asked us for two IDs, which is apparently a practice in BC..found that interesting and had to go back to our hotel to grab it. When we got in and saw how big the place was, it made a bit more sense to us!

I wish I could remember our servers name, he was fairly new to Victoria - recently moved from Calgary. He was great - super friendly and attentive.

The food was pretty good as well. Had the chicken quesadillas, Caesar salad and hubby got the jambalaya. Would definitely recommend checking this place out!Wish there were more vegetarian/vegan options, but for a traditional pub it was great! I had the Baha bowl with tofu and it was great. My friend had the bangers and mash and said it was ok.Our yearly tradition to visit while dine around is on. Have had some truly incredible experiences in past years.

This year was disappointing. Specifically:
1. Appy: spouse got the Brussels which was a good sized portion but they must have added two much lemon or something making it sour. The soup I got in comparison was tiny, but tasty.

2. Main course: spouse got steak and lobster. Although steak was medium rare it was tough and difficult to cut.

3. Service: We ran out of water in the small glasses of water they provide during our appy and was never offered a refill. The appy came relatively quickly but the gap between finishing appy before main and main to dessert was significant.

Will likely return again to give them another chance next year, but do recommend giving them a miss for the 2023 dine around."
ChIJh8S3aVJxj1QR1Fc9otI_Y1g,Thai Lemongrass Restaurant,4.2,48.461517,-123.2973538,499,"We came on a Thursday at around 4:00 pm. I had read multiple reviews where they said the service was slow etc. So I had prepared myself in advance for this and to my surprise it was not slow at all. But that's probably because the restaurant was empty at 4 and there was no one here but us. The food came out really fast and the servers were really attentive. They gave out new plates for appetizers, mains and desserts. They weren't over bearing but when asking for the bill and to order it might be a bit difficult depending on where you are sitting in the restaurant but that's just my take. On to the food!

Por pia -$10 - 4 spring rolls with a sweet and sour sauce. Very crispy. Lots of cabbage inside. Not overly salty

Prawn Pad Thai - $15.50 - big portion. I liked the proportion of fresh bean sprouts and peanuts to noodles. There were around 7-8 big shrimps which was very generous for the price. The noodles were nicely cooked. A lot of places that have pad Thai always overcook their noodles and they break easily but here they are still intact long noodles. They are bouncy and have a good chew to then. Not overly sweet or salty. Nicely seasoned and not too oily.

Vegetable green curry - $14.95 - lots of veggies - green peppers, bamboo shoots, carrots etc. The curry itself was really flavourful. Hint of lemongrass. Went so well with just plain rice. I could eat lots of rice with this dish (maybe 3 bowls haha)

Drunken chicken noodles - $14.50 - big portion. Very strong basil flavour overall which I really liked. The noodles were again nicely cooked. Good amount of chicken. Would definitely order it again.

Deep fried banana with ice cream - $5.50 - not too sweet. The batter was nice and thin and crispy. Good way to end the night.

Overall I would recommend this place for Thai food. The interior feels very homey and the service is pretty good. The portions are good enough to feed a couple people and the flavours are pretty good. The prices are also reasonable for the amount of food you get.

TIP: order their drunken noodlesThese guys are the real deal! I sat down and felt cared for. The whole meal the front of house staff were literally running back and forth to get everyone taken care of on a busy Friday night. Major props to those guys. There’s absolutely no doubt that they’re working hard. I even saw one of the servers take the time to work through a customer speaking in a language he didn’t understand. He was patient, kind and took the time to take great care of the customer despite the fact that it took him away from his duties to other customers. I have absolutely no problem waiting a few extra minutes for service like this.

The food was also fantastic. I ordered a pineapple fried rice and it was something completely new to me. The portion sizes were very generous and I left feeling the way one should feel walking out of a restaurant. Satisfied but wanting to taste more! Nowadays companies are doing everything they can to limit portion sizes and increase prices, Lemongrass did not meet this stereotype, they gave me a generous portion that left me satisfied with the price I paid. The dish also tasted absolutely amazing. 10/10 cannot wait to come back and try another dish. Bravo!Finally found the best Thai Food in Victoria. Made a reservation for 4:15 to avoid the dinner rush. Service was top notch and the the food did not disappoint. From the first sip of my Tom Ka Gai soup I knew I had finally found the quality authentic Thai I have been looking for. I’ll be back with more friends next time.I ordered takeout here for the first time, took an hour which was fine, I showed up on time, there was only one line for dining in or picking up. After a few minutes, I told the hostess I was here for pickup and she said to go back in line. After another 5 minutes or so, she asked my name and got our food, which was very good.
I don't think I will ever go here or get takeout again.Amazing food! Even better service! I ordered the red curry lunch combo, extra hot. It was perfect in every way, with enough food to take for a snack later. I loved it! They gave great beer as well. The staff was super attentive, but never overwhelming. The washroom was clean. The atmosphere is inviting and the location could not be better, within walking distance of the beach. I love this place and will be back!"
ChIJA1WLQ51zj1QRdR-rWkEa61c,The Ruby on Douglas,4.5,48.4461269,-123.3717851,1042,"Went here for brunch. The food was amazing & the portions were huge! The potatoes are the perfect crispy fluffy ratio. The duck just fell off the bone & the sauce that same with it paired perfectly well. Would definitely go back & recommended. Only downside is that it's small so not lots of seating, but still worth a visit. The staff were also helpful & friendly :)It was perfect place with baby. My friend took her 10 weeks girl. The staffs was so nice and kind. We ordered 3 kinds of dishes. All good. Yummy with good coffee! It was first time visiting. Park also convinced.Amazing! We've visited the Ruby on Johnson, and had an incredible breakfast before, so we figured we'd try this location too.

Incredible (seriously) service, with 100-watt smiles. Not sure what our server's name was, but she absolutely earned her Wonder Woman tattoo (thank you again for a wonderful experience)!

The food was as delicious (and filling) as our previous experience. The mountains of waffles had our kids on cloud nine, while the breakfast tacos were a slam dunk for the grown ups. I'm not sure what they were called, but the ones with bacon are absolutely phenomenal - especially when drizzled with their homemade garlic hot sauce.

Yeah, we'll be back, all right. :)What an awesome little gem hidden in plain sight, lol! Didn't have to wait too long for a table. Service was top notch, friendly, and prompt. I'm a Waffle 🧇/ Pancake 🥞 girl and The Ruby did not disappoint me. Caramelized bananas 🍌, roasted pecans and bourbon syrup, on top of a stack of mouth watering waffles 🧇. Hubby had an omelet with bacon 🥓, mushrooms 🍄, and cheese 🧀.
Thank you Ruby!!!! ✌️Tacos, chicken and waffles, duck hash and the meal or the day ! Very good, but a long wait. You must be patient if you want to come here, can take 30-40 min wait. But it has a nice sitting area. Good food though, was worth the wait."
ChIJDWBYFpF0j1QRPZHNC06-0RQ,The Old Spaghetti Factory (Victoria),4.2,48.4203224,-123.3660878,3261,"I was very impressed that they could accommodate a table of 8 at 5:30 on a Friday so quickly. The restaurant is huge so I understood more as we were seated. The design of the restaurant was good but fairly basic and comfortable. It was very busy but I felt like they did a great job getting food and drinks to us. The value of the food was pretty good and they have a great food and beverage selection. The kids meals were generous and tasty. I had the seafood fettuccine Alfredo and I found it quite watery and bland. My sister has the manicotti and she thought it was good. A good family restaurant with mid to high prices.Gosh! I tell you their spaghetti is awesome. I don’t take a picture of my food but, because I was so starving that evening so, I forgot to take some pictures. Everything was absolutely delicious and amazing supper. Their warm bread with whipped garlic butter were top notch! Keep asking them to refill and they bring it up on the table. Always make reservation before otherwise you will be waiting for a long time to get your table. And because they are busy, just be patience and be kind to the waitress. They serve you really well.Food was really good. Service was attentive, knowledgeable, welcoming.

Prices are great and everything-included makes it easy to budget for 4-or-more.

Personnel were great from host to server; seem like they worked well as a team during a busy, busy visit.

On a sunny mid-afternoon I walked in as a single guest. I got taken ahead of walk-in groups of 3+ and large group reservations.

I got visit. Not 'fine dining' but fine enough for me!

Service and customer attention: top-notch 5/5!Love this cozy warm restaurant with family friendly vibe. The “all included” can allow you have a nice sourdough bread to start your meal, salad or soup, and some tasty ice cream. Can’t wait to try other pastas next time!This place is one of the greatest!
Good value for money.
I’ve been to all this franchise and Gas town and this location are the best.
Evan, bar manager, is friendly and he knows how to practice greatest customer service and build a strong rapport with guests.
Recommend this place to everyone."
ChIJbxEhtYR0j1QRVpKccx2L85U,II Terrazzo,4.7,48.42741729999999,-123.3694372,3362,"One of the best restaurants in British Columbia! That’s all I can say;)

The whole restaurant is a vibe. I loved loved the interior design of this place!  So cozy and warm.
The staff is AMAZING. Very knowledgeable and excited about the food
You will love it!!!Be sure to book a table at least a week in advance if you need a certain time! Very attentive waiters, they offered to add water at least 5 times😏the most comfortable atmosphere, even though the flyers are sitting close, everyone speaks quietly and everything is very personal.  Only the kitchen upset us, maybe we ordered the wrong
dishes, since there are no photos of dishes on the menu. This place deserves another visit at least for pizza tasting☺️Oops…up a dress size! The food here is so amazing, full of flavours. The portions are huge too, we had to take some away in a box for tomorrow’s dinner. The decor is lovely, like being in an Italian courtyard. There’s a good wine list plus service is excellent.
We couldn’t manage desert, tempting as they were.Visited this place while we were in town as recommended by a friend. Upon reading a number of reviews, we ordered a seafood pasta and a calamari since we were feeling still half-full from lunch. They gladly accommodated our request for substituting mussels for more of other kinds of seafood. We were amazed at how everything tasted so fresh, from the focaccia and olives to the pasta! Especially the pasta was simply the best seafood pasta I have ever had (remember we were not too hungry to begin with..)! We loved it was tomato-based rather than oil-based, and the prawns and scallops were cooked to perfection. An added bonus was that our server, Marissa, was incredibly friendly and made us feel comfortable the entire time.A local legend in Victoria with a rich history. Haven’t been here in 20 years but it’s every bit as good. Generous portions and fair prices. The fresh made focaccia bread and olive tapenade are a wonderful start to the meal. Ambiance is great and super friendly servers. Very busy and booked out far in advance."
